"pkey","souce_system","event_name","event_description"
"EveK2622542677106","Desktop_Test_Flatfile","IRONMAN 70.3","Then song carry cold laugh parent a. Close ask try treat family age although stay. Financial act student there choice."
"EveK9390889204004","Desktop_Test_Flatfile","IRONMAN 70.3","Property at important lay religious data. Marriage money present police worry. News brother certain hospital debate list space.
Work five price town choose officer. Hand administration never."
"EveK8998887205170","Desktop_Test_Flatfile","IRONMAN 70.3","Gas arm situation sound everything cause always keep. Page air east half scene story analysis. Dark magazine study upon reflect idea."
"EveK8478892628770","Desktop_Test_Flatfile","IRONMAN 70.3","Several alone less air show. Interest list meet where. Exist let democratic half smile.
It ground simple. Truth next the amount walk decade. Image rock near how president machine."
"EveK8728273134018","Desktop_Test_Flatfile","IRONMAN 70.3","Painting among report party turn. Federal only partner number tell degree face."
"EveK1108793310937","Desktop_Test_Flatfile","IRONMAN 70.3","Knowledge drive long study about under important put. Choose him spend consumer sense employee security clearly. Recent want total attorney article."
"EveK2175072642231","Desktop_Test_Flatfile","IRONMAN 70.3","Field she maintain of maybe action. Could allow artist forward.
Building choose hundred important. Station inside ask surface.
Red station week raise whole entire. Base near eat coach most."
"EveK7072007174612","Desktop_Test_Flatfile","IRONMAN 70.3","Win shoulder home represent produce exist yeah. Arm million we reduce fly skill. Trouble miss about movie end.
Tree husband white meeting. Probably course professional week."
"EveK8064394539005","Desktop_Test_Flatfile","IRONMAN 70.3","More might clear whose administration. Play whatever camera star own claim piece.
Every face thing start. Culture director light choose door already own."
"EveK8119860919482","Desktop_Test_Flatfile","IRONMAN 70.3","Billion community keep theory pass hand computer. Toward account president some state."
