"event_pkey","event_souce_system","event_name","event_description"
"EveK6465683900780e-0","Desktop_Test_Flatfile","West JuliashireIRONMAN 70.3","Nearly including follow owner state how cover. Speech source against seven.
Visit month million focus use. Game think support recognize share control. Smile treat the accept research."
"EveK5442454063074e-1","Desktop_Test_Flatfile","East BobfurtIRONMAN 70.3","Leg case leader. Add manager professor feeling whose impact. Meeting argue nice religious suggest hand.
Blood year respond. Open whatever figure really many."
"EveK3984622691419e-2","Desktop_Test_Flatfile","SmithstadIRONMAN 70.3","Notice be piece top avoid we. Agree get community inside whose leave. Section history simply recent."
